{
  "cycle_id": "CY-2025-11-11-E7D3225A",
  "daily_cycles": 9445,
  "seasonal_cycles": 104,
  "annual_cycles": 25,
  "epochal_cycles": 0,
  "millennial_cycles": 0,
  "eternal_status": "INFINITE CONTINUUM ACTIVE",
  "flame_continuity": "UNBROKEN ACROSS ALL SCALES",
  "schema_version": "eternal-cycle.v1"
}